Title,RequesterName,RequestType,TargetDateStart,TargetDateEnd,RequestStatus,Description
Downtown Zoning Discussion,Alice Miller,Public,12/10/2025,12/12/2025,New,Resident wants to discuss zoning changes on 4th Street.
Q4 Budget Finalization,Sarah Jenkins,Internal Staff,12/11/2025,12/11/2025,New,Reviewing final allocation for Public Works.
New Park Inauguration Prep,John Doe,Internal Staff,12/12/2025,12/14/2025,Processing,Logistics planning for the ribbon-cutting ceremony.
Traffic Light Vendor Demo,TechSolutions Inc.,Vendor,12/15/2025,12/18/2025,New,Demo of smart traffic lights.
Utility Rate Protest,Community Action Group,Public,12/10/2025,12/11/2025,New,Group of 10 citizens requesting time to speak on water rates.